{
  "schemaVersion": 1,
  "kind": "format-contract",
  "id": "hashicorp-vault:recovery-token@1",
  "family": "hashicorp-vault:recovery-token",
  "revision": 1,
  "period": "current",
  "validity": {
    "from": null,
    "until": null
  },
  "supersedes": null,
  "structure": {},
  "claims": [
    {
      "id": "provider-source",
      "statement": "hvs./hvb./hvr. prefixes, 24+ random characters: prefixes and minimum length; the provider states the structure is opaque, so the 90–120-character rule the pinned tools use is corroboration, not contract [Legacy contract 'vault-token' is shared by 3 families; this statement is not specific to one of them.]",
      "evidenceClass": "provider-documented",
      "temporality": "current",
      "observedAt": "2026-09-17",
      "sources": [
        {
          "sourceId": "developer-hashicorp-com-449e83b314",
          "supports": "prefixes and minimum length; the provider states the structure is opaque, so the 90–120-character rule the pinned tools use is corroboration, not contract"
        }
      ]
    },
    {
      "id": "tool-corroboration",
      "statement": "Pinned scanner rules are consistent with the contract grammar (2 artifacts: gitleaks 8.30.1; trufflehog 3.97.4). [Legacy contract 'vault-token' is shared by 3 families; this statement is not specific to one of them.]",
      "evidenceClass": "tool-corroborated",
      "temporality": "current",
      "observedAt": "2026-09-17",
      "sources": [
        {
          "sourceId": "github-com-gitleaks-gitleaks-e50f42b821",
          "supports": "gitleaks 8.30.1: gitleaks.toml"
        },
        {
          "sourceId": "github-com-trufflesecurity-trufflehog-771aee8809",
          "supports": "trufflehog 3.97.4: hashicorpvault/hashicorpvaulttoken/hashicorpvaulttoken"
        }
      ]
    },
    {
      "id": "dossier-research",
      "statement": "Legacy dossier research (verdict ready, tier T1) cited 1 source; the dossier does not attribute sources to individual properties.",
      "evidenceClass": "provider-documented",
      "temporality": "current",
      "observedAt": "2026-09-20",
      "sources": [
        {
          "sourceId": "developer-hashicorp-com-449e83b314",
          "supports": "Cited by the legacy dossier research for this family"
        }
      ]
    }
  ],
  "lifecycle": "draft",
  "externalRefs": [
    {
      "system": "legacy-taxonomy-import",
      "id": "ade8a10bd7922765110a68986b0690eb3861f2e5:benchmarks/evaluation/domains/credential/assessment.ts",
      "url": "https://github.com/redact-secret/redact-secret-benchmarks/blob/ade8a10bd7922765110a68986b0690eb3861f2e5/benchmarks/evaluation/domains/credential/assessment.ts",
      "note": "contracts['vault-token']"
    },
    {
      "system": "legacy-taxonomy-import",
      "id": "ade8a10bd7922765110a68986b0690eb3861f2e5:benchmarks/support/dossiers/hashicorp-vault.md",
      "url": "https://github.com/redact-secret/redact-secret-benchmarks/blob/ade8a10bd7922765110a68986b0690eb3861f2e5/benchmarks/support/dossiers/hashicorp-vault.md",
      "note": "families[id=hashicorp-vault:recovery-token].research"
    },
    {
      "system": "legacy-taxonomy-import",
      "id": "ade8a10bd7922765110a68986b0690eb3861f2e5:benchmarks/support/taxonomy.json",
      "url": "https://github.com/redact-secret/redact-secret-benchmarks/blob/ade8a10bd7922765110a68986b0690eb3861f2e5/benchmarks/support/taxonomy.json",
      "note": "families[id=hashicorp-vault:recovery-token]"
    }
  ]
}
