{
  "schemaVersion": 1,
  "kind": "format-contract",
  "id": "pypi:api-token@1",
  "family": "pypi:api-token",
  "revision": 1,
  "period": "current",
  "validity": {
    "from": null,
    "until": null
  },
  "supersedes": null,
  "structure": {
    "descriptivePattern": "^pypi-[A-Za-z0-9_-]{85,}$"
  },
  "claims": [
    {
      "id": "provider-source",
      "statement": "pypi- prefix, base64-serialized PyMacaroon, {85,} length floor: docs.pypi.org's own detection-format page publishes this contract's exact regex, pypi-[A-Za-z0-9-_]{85,}: the pypi- prefix, a \"-\" separator, a base64 PyMacaroon serialization, an 85-character floor and no ceiling",
      "evidenceClass": "provider-documented",
      "temporality": "current",
      "observedAt": "2026-09-21",
      "sources": [
        {
          "sourceId": "docs-pypi-org-5aecbc9fa4",
          "supports": "docs.pypi.org's own detection-format page publishes this contract's exact regex, pypi-[A-Za-z0-9-_]{85,}: the pypi- prefix, a \"-\" separator, a base64 PyMacaroon serialization, an 85-character floor and no ceiling"
        }
      ]
    },
    {
      "id": "tool-corroboration",
      "statement": "Pinned scanner rules are consistent with the contract grammar (2 artifacts: gitleaks 8.30.1; trufflehog 3.97.4).",
      "evidenceClass": "tool-corroborated",
      "temporality": "current",
      "observedAt": "2026-09-21",
      "sources": [
        {
          "sourceId": "github-com-gitleaks-gitleaks-e50f42b821",
          "supports": "gitleaks 8.30.1: gitleaks.toml"
        },
        {
          "sourceId": "github-com-trufflesecurity-trufflehog-9276994cfa",
          "supports": "trufflehog 3.97.4: pypi/pypi"
        }
      ]
    },
    {
      "id": "listed-references",
      "statement": "The legacy contract lists 1 reference without stating which property each supports.",
      "evidenceClass": "unresolved",
      "temporality": "current",
      "observedAt": "2026-09-21",
      "sources": [
        {
          "sourceId": "pypi-org-816331561f",
          "supports": "Listed as a reference by the legacy contract",
          "locator": "#apitoken"
        }
      ]
    },
    {
      "id": "dossier-research",
      "statement": "Legacy dossier research (verdict ready, tier T1) cited 2 sources; the dossier does not attribute sources to individual properties.",
      "evidenceClass": "provider-documented",
      "temporality": "current",
      "observedAt": "2026-09-22",
      "sources": [
        {
          "sourceId": "docs-pypi-org-5aecbc9fa4",
          "supports": "Cited by the legacy dossier research for this family"
        },
        {
          "sourceId": "pypi-org-816331561f",
          "supports": "Cited by the legacy dossier research for this family",
          "locator": "#apitoken"
        }
      ]
    }
  ],
  "lifecycle": "draft",
  "externalRefs": [
    {
      "system": "legacy-taxonomy-import",
      "id": "ade8a10bd7922765110a68986b0690eb3861f2e5:benchmarks/evaluation/domains/credential/assessment.ts",
      "url": "https://github.com/redact-secret/redact-secret-benchmarks/blob/ade8a10bd7922765110a68986b0690eb3861f2e5/benchmarks/evaluation/domains/credential/assessment.ts",
      "note": "contracts['pypi-token']"
    },
    {
      "system": "legacy-taxonomy-import",
      "id": "ade8a10bd7922765110a68986b0690eb3861f2e5:benchmarks/support/dossiers/pypi.md",
      "url": "https://github.com/redact-secret/redact-secret-benchmarks/blob/ade8a10bd7922765110a68986b0690eb3861f2e5/benchmarks/support/dossiers/pypi.md",
      "note": "families[id=pypi:api-token].research"
    },
    {
      "system": "legacy-taxonomy-import",
      "id": "ade8a10bd7922765110a68986b0690eb3861f2e5:benchmarks/support/taxonomy.json",
      "url": "https://github.com/redact-secret/redact-secret-benchmarks/blob/ade8a10bd7922765110a68986b0690eb3861f2e5/benchmarks/support/taxonomy.json",
      "note": "families[id=pypi:api-token]"
    }
  ]
}
