{
  "schemaVersion": 1,
  "kind": "format-contract",
  "id": "canva:client-secret@1",
  "family": "canva:client-secret",
  "revision": 1,
  "period": "proposed",
  "validity": {
    "from": null,
    "until": null
  },
  "supersedes": null,
  "structure": {
    "components": [
      {
        "name": "prefix",
        "role": "prefix",
        "description": "The token endpoint reference says the client secret begins with cnvca; no separator, alphabet or length is stated."
      }
    ]
  },
  "claims": [
    {
      "id": "existence",
      "statement": "The Canva REST API authentication guide lists generating and saving a client secret as a prerequisite, and the token endpoint documents a client_secret parameter that begins with cnvca.",
      "evidenceClass": "provider-documented",
      "temporality": "current",
      "observedAt": "2026-10-04",
      "sources": [
        {
          "sourceId": "canva-dev-7dc1064fcc",
          "supports": "Before authenticating to the REST APIs, you must first create and configure your app in the Developer Portal, including: ... Generating and saving a client secret",
          "locator": "Prerequisites"
        },
        {
          "sourceId": "canva-dev-e6b9def37d",
          "supports": "client_secret string Optional Your app's client secret, for authenticating the request. Begins with cnvca .",
          "locator": "Body parameters"
        }
      ]
    }
  ],
  "lifecycle": "draft",
  "notes": "Project-authored by the Redact Secret project, which maintains this repository; not independent evidence. Draft; not yet reviewed.",
  "openQuestions": [
    {
      "id": "open-question-1",
      "question": "Whether the prefix is stable across app generations, and the length, alphabet and any checksum of the remainder, are not stated by the pages read. The client secret is carried either in an HTTP Basic Authorization header (Base64 of client id and client secret joined by a colon, as the authentication guide states) or as a client_secret form body parameter; the carrier encodings are not researched here. The candidate is not researched beyond existence and a documented prefix.",
      "raisedAt": "2026-10-04"
    }
  ]
}
