{
  "schemaVersion": 1,
  "kind": "format-contract",
  "id": "kubernetes:kubeconfig-user-credentials@1",
  "family": "kubernetes:kubeconfig-user-credentials",
  "revision": 1,
  "period": "current",
  "validity": {
    "from": null,
    "until": null
  },
  "supersedes": null,
  "structure": {
    "separators": [
      ":"
    ],
    "components": [
      {
        "name": "users-entry",
        "role": "other",
        "description": "A named entry in the top-level users list whose user mapping holds the authentication fields."
      },
      {
        "name": "inline-secret-fields",
        "role": "body",
        "description": "token, password and client-key-data hold the value inline."
      },
      {
        "name": "file-reference-fields",
        "role": "other",
        "description": "tokenFile, client-key, client-certificate and certificate-authority hold a path to a file."
      }
    ]
  },
  "claims": [
    {
      "id": "user-authentication-fields",
      "statement": "The Kubernetes client-go kubeconfig types give a users entry (AuthInfo) these authentication fields: client-certificate and client-certificate-data, client-key and client-key-data, token, tokenFile, username, password, auth-provider and exec, plus impersonation fields; every field is optional.",
      "evidenceClass": "provider-documented",
      "temporality": "current",
      "observedAt": "2026-10-03",
      "sources": [
        {
          "sourceId": "github-com-kubernetes-client-go-23c99d01ce",
          "supports": "type AuthInfo struct { ClientCertificate, ClientCertificateData, ClientKey, ClientKeyData, Token, TokenFile, Impersonate..., Username, Password, AuthProvider, Exec, Extensions }, each marked +optional.",
          "locator": "tools/clientcmd/api/v1/types.go#L102-L148"
        }
      ]
    },
    {
      "id": "secret-valued-fields-tagged",
      "statement": "In the same types, ClientKeyData is declared with datapolicy \"security-key\", Token with datapolicy \"token\" and Password with datapolicy \"password\"; no other field of AuthInfo or Cluster carries a datapolicy tag.",
      "evidenceClass": "provider-documented",
      "temporality": "current",
      "observedAt": "2026-10-03",
      "sources": [
        {
          "sourceId": "github-com-kubernetes-client-go-23c99d01ce",
          "supports": "ClientKeyData []byte `json:\"client-key-data,omitempty\" datapolicy:\"security-key\"`; Token string `json:\"token,omitempty\" datapolicy:\"token\"`; Password string `json:\"password,omitempty\" datapolicy:\"password\"`.",
          "locator": "tools/clientcmd/api/v1/types.go#L114"
        },
        {
          "sourceId": "github-com-kubernetes-client-go-23c99d01ce",
          "supports": "Token string with datapolicy token (Token is the bearer token for authentication to the kubernetes cluster).",
          "locator": "tools/clientcmd/api/v1/types.go#L115-L117"
        },
        {
          "sourceId": "github-com-kubernetes-client-go-23c99d01ce",
          "supports": "Password string with datapolicy password (Password is the password for basic authentication to the kubernetes cluster).",
          "locator": "tools/clientcmd/api/v1/types.go#L134-L139"
        }
      ]
    },
    {
      "id": "client-key-data-is-pem-encoded-key",
      "statement": "client-key-data \"contains PEM-encoded data from a client key file for TLS\" and overrides the client-key path.",
      "evidenceClass": "provider-documented",
      "temporality": "current",
      "observedAt": "2026-10-03",
      "sources": [
        {
          "sourceId": "github-com-kubernetes-client-go-23c99d01ce",
          "supports": "ClientKeyData contains PEM-encoded data from a client key file for TLS. Overrides ClientKey",
          "locator": "tools/clientcmd/api/v1/types.go#L112-L114"
        }
      ]
    },
    {
      "id": "file-reference-fields-are-paths",
      "statement": "client-key and client-certificate are paths to files, certificate-authority is the path to a cert file, tokenFile \"is a pointer to a file that contains a bearer token\"; file and path references in a kubeconfig are relative to the location of the kubeconfig file.",
      "evidenceClass": "provider-documented",
      "temporality": "current",
      "observedAt": "2026-10-03",
      "sources": [
        {
          "sourceId": "github-com-kubernetes-client-go-23c99d01ce",
          "supports": "ClientKey is the path to a client key file for TLS; TokenFile is a pointer to a file that contains a bearer token.",
          "locator": "tools/clientcmd/api/v1/types.go#L109-L121"
        },
        {
          "sourceId": "kubernetes-io-827da0cf09",
          "supports": "File and path references in a kubeconfig file are relative to the location of the kubeconfig file.",
          "locator": "section: File references"
        }
      ]
    },
    {
      "id": "lists-of-clusters-users-contexts",
      "statement": "A kubeconfig holds lists of clusters, users and contexts; a context groups a cluster, a user and an optional namespace under a name, so one file can carry several users, each with its own credential fields.",
      "evidenceClass": "provider-documented",
      "temporality": "current",
      "observedAt": "2026-10-03",
      "sources": [
        {
          "sourceId": "github-com-kubernetes-client-go-23c99d01ce",
          "supports": "Config has Clusters []NamedCluster, AuthInfos []NamedAuthInfo (json \"users\") and Contexts []NamedContext; Context has Cluster, AuthInfo (json \"user\") and Namespace.",
          "locator": "tools/clientcmd/api/v1/types.go#L28-L52"
        }
      ]
    },
    {
      "id": "serialized-encoding-of-data-fields",
      "statement": "The pages read give the data fields the Go type []byte and say they hold PEM-encoded data; they do not state the text encoding of those fields in a serialized file. Base64 is the usual serialization of a Go []byte in JSON and YAML but that is not read from a source here.",
      "evidenceClass": "unresolved",
      "temporality": "current",
      "observedAt": "2026-10-03",
      "sources": [
        {
          "sourceId": "github-com-kubernetes-client-go-23c99d01ce",
          "supports": "Fields typed []byte with PEM-encoded data; no statement of the serialized text encoding.",
          "locator": "tools/clientcmd/api/v1/types.go#L112-L114"
        }
      ]
    },
    {
      "id": "exec-and-auth-provider-values",
      "statement": "ExecConfig.Env holds name and value pairs \"exposed to the process\" and AuthProviderConfig.Config is a map of strings; no page read says whether those values are confidential.",
      "evidenceClass": "unresolved",
      "temporality": "current",
      "observedAt": "2026-10-03",
      "sources": [
        {
          "sourceId": "github-com-kubernetes-client-go-23c99d01ce",
          "supports": "Env defines additional environment variables to expose to the process; AuthProviderConfig has Name and Config map[string]string. No statement of confidentiality.",
          "locator": "tools/clientcmd/api/v1/types.go#L198-L254"
        }
      ]
    },
    {
      "id": "certificate-and-endpoint-confidentiality",
      "statement": "certificate-authority-data and client-certificate-data are described as PEM-encoded certificates and server as the cluster address; no page read states whether those values are confidential or public. They carry no datapolicy tag, which is metadata about logging and not a statement that a value is public.",
      "evidenceClass": "unresolved",
      "temporality": "current",
      "observedAt": "2026-10-03",
      "sources": [
        {
          "sourceId": "github-com-kubernetes-client-go-23c99d01ce",
          "supports": "Cluster.Server, CertificateAuthorityData and AuthInfo.ClientCertificateData comments; no confidentiality statement.",
          "locator": "tools/clientcmd/api/v1/types.go#L65-L108"
        }
      ]
    }
  ],
  "lifecycle": "draft",
  "notes": "Project-authored by the Redact Secret project, which maintains this repository; not independent evidence. Draft; not yet reviewed.",
  "openQuestions": [
    {
      "id": "open-question-1",
      "question": "Is client-certificate-data (a certificate) public, and is certificate-authority-data? No Kubernetes page read says so.",
      "raisedAt": "2026-10-03"
    },
    {
      "id": "open-question-2",
      "question": "Which exec.env values and auth-provider config entries are secrets is not stated.",
      "raisedAt": "2026-10-03"
    }
  ]
}
