{
  "schemaVersion": 1,
  "kind": "format-contract",
  "id": "aws:s3-presigned-url@1",
  "family": "aws:s3-presigned-url",
  "revision": 1,
  "period": "current",
  "validity": {
    "from": null,
    "until": null
  },
  "supersedes": null,
  "structure": {
    "separators": [
      "?",
      "&",
      "="
    ],
    "components": [
      {
        "name": "resource-url",
        "role": "other",
        "description": "Scheme, bucket or access-point host, and object key path; the object address is not documented as a secret."
      },
      {
        "name": "signing-parameters",
        "role": "other",
        "description": "Query parameters X-Amz-Algorithm, X-Amz-Credential, X-Amz-Date, X-Amz-SignedHeaders, X-Amz-Signature, URI-encoded; X-Amz-Security-Token when temporary credentials are used. The signature is lowercase hexadecimal."
      }
    ]
  },
  "claims": [
    {
      "id": "presigned-url-is-bearer",
      "statement": "AWS states that presigned URLs are bearer tokens that grant access to those who possess them, limited by the permissions of the principal that created them.",
      "evidenceClass": "provider-documented",
      "temporality": "current",
      "observedAt": "2026-10-03",
      "sources": [
        {
          "sourceId": "docs-aws-amazon-com-3a070b6e70",
          "supports": "In essence, presigned URLs are bearer tokens that grant access to those who possess them.",
          "locator": "#PresignedUrlUploadObject-LimitCapabilities"
        }
      ]
    },
    {
      "id": "expiry-and-reuse",
      "statement": "A presigned URL remains valid for the period specified when generated (up to 7 days with the AWS CLI or SDKs, 1 minute to 12 hours from the console), can be used multiple times until expiry, and expires early when the creating temporary credential expires or is revoked; expiry is checked at request time.",
      "evidenceClass": "provider-documented",
      "temporality": "current",
      "observedAt": "2026-10-03",
      "sources": [
        {
          "sourceId": "docs-aws-amazon-com-3a070b6e70",
          "supports": "A presigned URL remains valid for the period of time specified when the URL is generated; You can use the presigned URL multiple times, up to the expiration date and time.",
          "locator": "#PresignedUrl-Expiration"
        }
      ]
    },
    {
      "id": "query-parameter-names",
      "statement": "The SigV4 query-string form carries X-Amz-Algorithm, X-Amz-Credential (access key ID and credential scope), X-Amz-Date, X-Amz-SignedHeaders and X-Amz-Signature (lowercase hexadecimal); X-Amz-Security-Token holds the session token when temporary credentials are used. The documented query example is for an EC2 API request; the S3 presigned-URL page names X-Amz-SignedHeaders but does not list the whole parameter set.",
      "evidenceClass": "provider-documented",
      "temporality": "current",
      "observedAt": "2026-10-03",
      "sources": [
        {
          "sourceId": "docs-aws-amazon-com-28f7e2245c",
          "supports": "Example: Request with authentication parameters in the query string (X-Amz-Algorithm, X-Amz-Credential, X-Amz-Date, X-Amz-SignedHeaders, X-Amz-Signature); X-Amz-Security-Token may be included in the query string.",
          "locator": "#add-signature-to-request"
        },
        {
          "sourceId": "docs-aws-amazon-com-3a070b6e70",
          "supports": "X-Amz-SignedHeaders is named in the presigned-URL FAQ.",
          "locator": "#PresignedUrlFAQ"
        }
      ]
    },
    {
      "id": "uri-encoding-rule",
      "statement": "SigV4 specifies that query names and values are URI-encoded with uppercase hexadecimal escapes, unreserved characters left unencoded and space as %20, and the canonical query string sorts parameters after encoding. This governs signing, not how a URL may be written when shared.",
      "evidenceClass": "provider-documented",
      "temporality": "current",
      "observedAt": "2026-10-03",
      "sources": [
        {
          "sourceId": "docs-aws-amazon-com-28f7e2245c",
          "supports": "UriEncode() rules: Letters in the hexadecimal value must be uppercase; sort the parameters in the canonical query string alphabetically by key name.",
          "locator": "#create-canonical-request"
        }
      ]
    },
    {
      "id": "which-part-is-secret-extent",
      "statement": "The pages call the whole presigned URL a bearer token. They do not say whether the X-Amz-Signature value alone, the query string or the whole URL is the minimal span to mask, whether X-Amz-Credential (access key ID plus scope) is public metadata, or how duplicate or reordered parameters behave in a shared URL.",
      "evidenceClass": "unresolved",
      "temporality": "current",
      "observedAt": "2026-10-03",
      "sources": [
        {
          "sourceId": "docs-aws-amazon-com-3a070b6e70",
          "supports": "Bearer-token statement only; no minimal-span statement.",
          "locator": "#PresignedUrlUploadObject-LimitCapabilities"
        }
      ]
    }
  ],
  "lifecycle": "draft",
  "notes": "Project-authored by the Redact Secret project, which maintains this repository; not independent evidence. Draft; not yet reviewed.",
  "openQuestions": [
    {
      "id": "open-question-1",
      "question": "Minimal masking extent (signature value, query string, whole URL) is not stated by AWS.",
      "raisedAt": "2026-10-03"
    },
    {
      "id": "open-question-2",
      "question": "Whether duplicate or reordered X-Amz-* parameters are accepted by S3 is not documented on the pages read.",
      "raisedAt": "2026-10-03"
    },
    {
      "id": "open-question-3",
      "question": "Whether an expired presigned URL is still a value to protect is a policy question, not a provider statement.",
      "raisedAt": "2026-10-03"
    }
  ]
}
