{
  "schemaVersion": 1,
  "kind": "format-contract",
  "id": "grafana:service-account-token@1",
  "family": "grafana:service-account-token",
  "revision": 1,
  "period": "current",
  "validity": {
    "from": null,
    "until": null
  },
  "supersedes": null,
  "structure": {
    "descriptivePattern": "^glsa_[A-Za-z0-9]{32}_[0-9A-Fa-f]{8}$"
  },
  "claims": [
    {
      "id": "provider-source",
      "statement": "glsa service-account token prefix: Grafana states that service account tokens carry a glsa prefix; the delimiter, segment lengths, alphabet and checksum placement remain tool-corroborated",
      "evidenceClass": "provider-documented",
      "temporality": "current",
      "observedAt": "2026-09-23",
      "sources": [
        {
          "sourceId": "grafana-com-a0ba1e71f3",
          "supports": "Grafana states that service account tokens carry a glsa prefix; the delimiter, segment lengths, alphabet and checksum placement remain tool-corroborated"
        }
      ]
    },
    {
      "id": "tool-corroboration",
      "statement": "Pinned scanner rules are consistent with the contract grammar (2 artifacts: gitleaks 8.30.1; trufflehog 3.97.4).",
      "evidenceClass": "tool-corroborated",
      "temporality": "current",
      "observedAt": "2026-09-23",
      "sources": [
        {
          "sourceId": "github-com-gitleaks-gitleaks-e50f42b821",
          "supports": "gitleaks 8.30.1: gitleaks.toml"
        },
        {
          "sourceId": "github-com-trufflesecurity-trufflehog-105f1b824c",
          "supports": "trufflehog 3.97.4: grafanaserviceaccount/grafanaserviceaccount"
        }
      ]
    },
    {
      "id": "dossier-research",
      "statement": "Legacy dossier research (verdict ready, tier T1) cited 2 sources; the dossier does not attribute sources to individual properties.",
      "evidenceClass": "provider-documented",
      "temporality": "current",
      "observedAt": "2026-09-23",
      "sources": [
        {
          "sourceId": "github-com-redact-secret-redact-secret-991482f3da",
          "supports": "Final research evidence recorded by the legacy dossier"
        },
        {
          "sourceId": "grafana-com-a0ba1e71f3",
          "supports": "Cited by the legacy dossier research for this family"
        }
      ]
    }
  ],
  "lifecycle": "draft",
  "externalRefs": [
    {
      "system": "legacy-taxonomy-import",
      "id": "1020d2b5905e8973098235e57c4cdca3359bba57:benchmarks/evaluation/domains/credential/assessment.ts",
      "url": "https://github.com/redact-secret/redact-secret-benchmarks/blob/1020d2b5905e8973098235e57c4cdca3359bba57/benchmarks/evaluation/domains/credential/assessment.ts",
      "note": "contracts['grafana-service-account-token']"
    },
    {
      "system": "legacy-taxonomy-import",
      "id": "1020d2b5905e8973098235e57c4cdca3359bba57:benchmarks/support/dossiers/grafana.md",
      "url": "https://github.com/redact-secret/redact-secret-benchmarks/blob/1020d2b5905e8973098235e57c4cdca3359bba57/benchmarks/support/dossiers/grafana.md",
      "note": "families[id=grafana:service-account-token].research"
    },
    {
      "system": "legacy-taxonomy-import",
      "id": "1020d2b5905e8973098235e57c4cdca3359bba57:benchmarks/support/taxonomy.json",
      "url": "https://github.com/redact-secret/redact-secret-benchmarks/blob/1020d2b5905e8973098235e57c4cdca3359bba57/benchmarks/support/taxonomy.json",
      "note": "families[id=grafana:service-account-token]"
    }
  ]
}
