{
  "schemaVersion": 1,
  "kind": "format-contract",
  "id": "digitalocean:refresh-token@1",
  "family": "digitalocean:refresh-token",
  "revision": 1,
  "period": "current",
  "validity": {
    "from": null,
    "until": null
  },
  "supersedes": null,
  "structure": {},
  "claims": [
    {
      "id": "provider-source",
      "statement": "2022-03-29 token prefixes: dop_v1_/doo_v1_/dor_v1_ prefixes; 64-hex body is tool-corroborated [Legacy contract 'digitalocean-token' is shared by 3 families; this statement is not specific to one of them.]",
      "evidenceClass": "provider-documented",
      "temporality": "current",
      "observedAt": "2026-09-17",
      "sources": [
        {
          "sourceId": "docs-digitalocean-com-8011080335",
          "supports": "dop_v1_/doo_v1_/dor_v1_ prefixes; 64-hex body is tool-corroborated"
        }
      ]
    },
    {
      "id": "tool-corroboration",
      "statement": "Pinned scanner rules are consistent with the contract grammar (2 artifacts: gitleaks 8.30.1; trufflehog 3.97.4). [Legacy contract 'digitalocean-token' is shared by 3 families; this statement is not specific to one of them.]",
      "evidenceClass": "tool-corroborated",
      "temporality": "current",
      "observedAt": "2026-09-17",
      "sources": [
        {
          "sourceId": "github-com-gitleaks-gitleaks-e50f42b821",
          "supports": "gitleaks 8.30.1: gitleaks.toml"
        },
        {
          "sourceId": "github-com-trufflesecurity-trufflehog-bd181bf570",
          "supports": "trufflehog 3.97.4: digitaloceanv2/digitaloceanv2"
        }
      ]
    },
    {
      "id": "dossier-research",
      "statement": "Legacy dossier research (verdict ready, tier T1) cited 3 sources; the dossier does not attribute sources to individual properties.",
      "evidenceClass": "provider-documented",
      "temporality": "current",
      "observedAt": "2026-09-17",
      "sources": [
        {
          "sourceId": "docs-digitalocean-com-8011080335",
          "supports": "Cited by the legacy dossier research for this family"
        },
        {
          "sourceId": "docs-digitalocean-com-afafb98e40",
          "supports": "Cited by the legacy dossier research for this family"
        },
        {
          "sourceId": "github-com-redact-secret-redact-secret-9a8e9c56d4",
          "supports": "Final research evidence recorded by the legacy dossier"
        }
      ]
    }
  ],
  "lifecycle": "draft",
  "externalRefs": [
    {
      "system": "legacy-taxonomy-import",
      "id": "ade8a10bd7922765110a68986b0690eb3861f2e5:benchmarks/evaluation/domains/credential/assessment.ts",
      "url": "https://github.com/redact-secret/redact-secret-benchmarks/blob/ade8a10bd7922765110a68986b0690eb3861f2e5/benchmarks/evaluation/domains/credential/assessment.ts",
      "note": "contracts['digitalocean-token']"
    },
    {
      "system": "legacy-taxonomy-import",
      "id": "ade8a10bd7922765110a68986b0690eb3861f2e5:benchmarks/support/dossiers/digitalocean.md",
      "url": "https://github.com/redact-secret/redact-secret-benchmarks/blob/ade8a10bd7922765110a68986b0690eb3861f2e5/benchmarks/support/dossiers/digitalocean.md",
      "note": "families[id=digitalocean:refresh-token].research"
    },
    {
      "system": "legacy-taxonomy-import",
      "id": "ade8a10bd7922765110a68986b0690eb3861f2e5:benchmarks/support/taxonomy.json",
      "url": "https://github.com/redact-secret/redact-secret-benchmarks/blob/ade8a10bd7922765110a68986b0690eb3861f2e5/benchmarks/support/taxonomy.json",
      "note": "families[id=digitalocean:refresh-token]"
    }
  ]
}
